{
  "schema_version": 4,
  "name": "A-level Chemistry (AQA 7405)",
  "requires_complete": [
    [
      "gcse_chemistry",
      "gcse_combined_science"
    ],
    "gcse_mathematics"
  ],
  "standalone": false,
  "selected_options": {
    "practical_endorsement": "not covered (teacher-assessed, separate from the grade)"
  },
  "folder_access": {
    "status": "pending_confirmation"
  },
  "currency": "live",
  "material_vintage": "AQA AS and A-level Chemistry (7404/7405) specification, Version 1.2 (July 2026), linked from aqa.org.uk/7405 and itemised on 2026-09-27: every content code at its deepest level (3.1.1.1-3.3.16), the mathematical requirements MS 0.0-4.3, the practical skills PS1.1-4.1, the apparatus and techniques ATa-l and the twelve required practicals. The hands-on apparatus list (practical endorsement only) is declared out of scope. Assessment: Paper 1 (2 h, 105 marks, 35%: physical chemistry 3.1.1-3.1.4, 3.1.6-3.1.8 and 3.1.10-3.1.12, and inorganic chemistry), Paper 2 (2 h, 105 marks, 35%: physical chemistry 3.1.2-3.1.6 and 3.1.9, and organic chemistry), Paper 3 (2 h, 90 marks, 30%: any content; 40 marks on practical techniques and data analysis, 20 marks across the specification, 30 multiple-choice). Stage tests and the mock are original questions in AQA's style; every numerical answer was computed when the course was built.",
  "academic_level": 3,
  "level_source": "RQF Level 3 (GCE A-level), per Ofqual's register listing for AQA 7405",
  "level_basis": "framework",
  "grounding_status": "verified",
  "last_live_recheck": "2026-09-27",
  "coverage_status": "full",
  "linear": true,
  "framework": null,
  "practical_stages": {},
  "learner_notices": [
    {
      "id": "practical_endorsement",
      "text": "The A-level grade comes only from the written papers. AQA also reports a separate practical endorsement, assessed by a teacher watching you work in a lab. This course teaches the required practicals' methods, observations, analysis and evaluation for the written papers, but it cannot award or replace the endorsement."
    },
    {
      "id": "drawing",
      "text": "Chemistry answers often need drawn structures and curly-arrow mechanisms. In this course they are described in words and text formulae; in the exam you must draw them, so practise sketching each mechanism on paper as you go."
    }
  ],
  "exam": {
    "enabled": true,
    "requires_all_stage_tests_passed": true
  },
  "stage_ladder": [
    "S01_Atomic_Structure",
    "S02_Amount_of_Substance",
    "S03_Bonding",
    "S04_Energetics",
    "S05_Kinetics",
    "S06_Equilibria_and_Kc",
    "S07_Redox",
    "S08_Periodicity_Group2_Group7",
    "S09_Organic_Basics_and_Alkanes",
    "S10_Halogenoalkanes_and_Alkenes",
    "S11_Alcohols",
    "S12_Organic_Analysis",
    "S13_Thermodynamics",
    "S14_Rate_Equations",
    "S15_Kp",
    "S16_Electrode_Potentials",
    "S17_Acids_and_Bases",
    "S18_Period3_and_Transition_Metals",
    "S19_Transition_Metal_Chemistry",
    "S20_Optical_Isomerism_Carbonyls",
    "S21_Carboxylic_Acids_and_Aromatics",
    "S22_Amines_and_Polymers",
    "S23_Amino_Acids_Proteins_DNA",
    "S24_Synthesis_NMR_Chromatography",
    "S25_Practical_Skills_and_Data_Analysis"
  ]
}