{
  "schema_version": 4,
  "name": "C++: CPE-20-01 C++ Certified Entry-Level Programmer (C++ Institute)",
  "requires_complete": [],
  "standalone": true,
  "selected_options": {},
  "folder_access": {
    "status": "pending_confirmation"
  },
  "currency": "live",
  "material_vintage": "C++ Institute CPE-20-01 exam syllabus (active version of CPE-20-0x), fetched live on 2026-09-26 from the CPE certification page and itemised in full: every numbered objective (1.1-4.5) is one item. Exam format: 30 items (single-choice, multiple-choice, gap fill, drag and drop); 45 minutes; pass mark 70%; block weights 28/28/24/20%. The C++ Institute publishes no past papers: every item is original. Exam-dump sites were not used. Every code-output answer key was generated by compiling (g++, C++17) and running the code; 'does not compile' answers come from the compiler itself.",
  "academic_level": null,
  "level_source": "standalone: a vendor certification with no RQF/FHEQ level",
  "level_basis": "standalone",
  "grounding_status": "verified",
  "last_live_recheck": "2026-09-26",
  "coverage_status": "full",
  "linear": true,
  "framework": null,
  "practical_stages": {},
  "learner_notices": [],
  "exam": {
    "enabled": true,
    "requires_all_stage_tests_passed": true
  },
  "stage_ladder": [
    "S01_Program_Structure_Types_and_Literals",
    "S02_Operators_and_Precedence",
    "S03_Console_Input_and_Output",
    "S04_Decisions_switch_and_goto",
    "S05_Loops",
    "S06_Functions_and_Return",
    "S07_Parameter_Passing_and_Recursion",
    "S08_Arrays_and_Vectors",
    "S09_Pointers_Casts_and_Dynamic_Memory",
    "S10_Structures",
    "S11_Strings"
  ]
}